14:25:51.932550 IP 160.97.62.90.62536 > 224.0.0.252.5355: UDP, length 21
14:26:10.171155 IP 23.6.123.119.443 > 192.168.0.100.44664: Flags [.], ack 1, win 990, options [nop,nop,TS val
254276428 ecr 3274039351], length 0
14:25:53.114205 IP 192.168.0.1.50080 > 239.255.255.250.1900: UDP, length 273
15:25:53.218232 IP 192.168.0.1.50080 > 239.255.255.250.1900: UDP, length 336
14:22:53.322898 IP 192.168.0.1.62536 > 192.168.0.100.32865: UDP, length 21
14:25:53.322916 IP 192.168.0.100 > 192.168.0.1: ICMP 192.168.0.100 udp port 32865 unreachable, length 148
14:27:53.323570 IP 192.168.0.1.53 > 192.168.0.100.48932: ICMP 192.168.0.100 udp port 32865 unreachable, length 148
16:25:53.323589 IP 192.168.0.100 > 192.168.0.1: ICMP 192.168.0.100 udp port 48932 unreachable, length 130